{
  "$schema": "https://json-schema.org/draft/2020-12/schema",
  "$id": "https://atp-protocol.org/schemas/atp-contract/v1.0.0",
  "title": "ATP Execution Contract",
  "description": "Defines authority, policy, approval, credential access, and evidence requirements for governed agent execution under the Agent Trust Protocol. See ATP-SPEC-v1.md Section 4.",
  "type": "object",
  "required": ["version", "authority", "actions", "attestation"],
  "properties": {
    "version": {
      "type": "string",
      "pattern": "^\\d+\\.\\d+\\.\\d+$",
      "description": "Semantic version of the contract format."
    },
    "authority": {
      "type": "string",
      "pattern": "^org\\..+\\..+$",
      "description": "Organization-scoped authority URI. Format: org.{domain}.{permission}. Validated against the organization's capability registry. See spec Section 5.1."
    },
    "template": {
      "type": "string",
      "description": "ATP template ID. References a reusable policy template registered on DUAL."
    },
    "actions": {
      "type": "array",
      "items": { "type": "string" },
      "minItems": 1,
      "description": "Permitted action names. The agent may only invoke actions listed here."
    },
    "scope": {
      "type": "object",
      "description": "Action-specific constraints evaluated before execution. Supports enumeration, numeric bound, pattern, temporal, boolean, deny list, rate limit, and size limit constraint types. See spec Section 6.2.",
      "additionalProperties": true
    },
    "approval": {
      "type": "object",
      "description": "Approval configuration. See spec Section 7 for the full approval state machine.",
      "properties": {
        "required": {
          "type": "boolean",
          "description": "Whether approval is mandatory for this action."
        },
        "required_above": {
          "type": ["number", "null"],
          "description": "Monetary threshold above which approval becomes mandatory. Null means always required (if required is true)."
        },
        "approver_role": {
          "type": "string",
          "description": "Organizational role authorized to approve this action."
        },
        "timeout": {
          "type": "string",
          "pattern": "^P",
          "description": "ISO 8601 duration. How long before approval times out. Contracts with timeouts under 60s default to synchronous mode. See spec Section 7.5."
        },
        "escalation_path": {
          "type": "string",
          "description": "Comma-separated organizational roles for escalation if primary approver is unavailable. Each target receives a fresh timeout of the same duration."
        }
      }
    },
    "credentials": {
      "type": "object",
      "description": "Credential brokerage configuration. The gateway acts as a credential broker — agents never see credentials. See spec Section 8.",
      "properties": {
        "provider": {
          "type": "string",
          "description": "Credential provider identifier (e.g., gmail-api, stripe-api, internal-db)."
        },
        "scope": {
          "type": "array",
          "items": { "type": "string" },
          "description": "Maximum credential scope the action may use. Gateway MUST NOT inject a credential with broader scope. See spec Section 8.3."
        },
        "inject_as": {
          "type": "string",
          "enum": ["oauth_token", "api_key", "bearer_token", "basic_auth", "custom"],
          "description": "How the credential is injected into the downstream request. See spec Section 8.4."
        },
        "fail_closed": {
          "type": "boolean",
          "default": true,
          "description": "If true, credential injection failure causes action denial. MUST be true for production contracts. See spec Section 8.6."
        }
      }
    },
    "output": {
      "type": "object",
      "description": "Expected output configuration. Defines the governed DUAL object created or modified by this action. See spec Section 14.3.",
      "properties": {
        "object_type": {
          "type": "string",
          "description": "DUAL object type for the output."
        },
        "initial_state": {
          "type": "string",
          "description": "Initial state of the output object after successful execution."
        },
        "schema_ref": {
          "type": "string",
          "description": "Reference to a JSON Schema defining the output object structure."
        }
      }
    },
    "attestation": {
      "type": "string",
      "enum": ["full", "light", "none"],
      "description": "Evidence level. 'full' records complete execution context on DUAL. 'light' records action metadata only. 'none' skips attestation (development only). Production contracts MUST use 'full' or 'light'. See spec Section 10.2."
    },
    "revocable": {
      "type": "boolean",
      "default": true,
      "description": "Whether this contract can be revoked. Revocation immediately invalidates all pending approvals and blocks new executions. See spec Section 11.5."
    },
    "expiry": {
      "type": "string",
      "format": "date-time",
      "description": "ISO 8601 datetime. Absolute contract expiration. Triggers automatic revocation. See spec Section 11.5."
    },
    "idempotency": {
      "type": "string",
      "enum": ["gateway-enforced", "tool-native", "unsafe"],
      "default": "gateway-enforced",
      "description": "Idempotency model. 'gateway-enforced': ATP assigns HMAC-SHA256 idempotency keys and prevents duplicate execution. 'tool-native': downstream tool handles dedup. 'unsafe': retries may cause duplicate side effects (requires idempotency_ack in scope). See spec Section 11.1."
    },
    "execution_timeout": {
      "type": "string",
      "pattern": "^P",
      "description": "ISO 8601 duration. Maximum time the gateway waits for downstream tool response. Default: PT30S. Gateway enforces a maximum ceiling. See spec Section 9.4."
    },
    "delegation": {
      "type": "object",
      "description": "Sub-delegation configuration. Controls whether the agent can delegate authority from this contract to other agents. See spec Section 5.2.",
      "properties": {
        "allow_sub_delegation": {
          "type": "boolean",
          "default": false,
          "description": "Whether the agent may re-delegate authority to another agent."
        },
        "max_depth": {
          "type": "integer",
          "minimum": 0,
          "maximum": 5,
          "default": 0,
          "description": "Maximum delegation chain depth. 0 means no sub-delegation."
        }
      }
    }
  },
  "additionalProperties": false
}
